{
  "ageContext": {
    "ageTopCoded": false,
    "ageYearsUsed": 35,
    "healthAgeSupported": true,
    "isApproximate": false,
    "notice": "출생연월과 기준일로 만 나이를 계산했습니다.",
    "policy": "completed_birth_month_lower_age_v1",
    "possibleAgeYears": [
      35,
      35
    ],
    "referenceDate": "2026-09-30",
    "timezone": "Asia/Seoul"
  },
  "ageTopCoded": false,
  "availableComponentCount": 4,
  "availableComponents": [
    "physical",
    "diabetes",
    "hypertension",
    "lifestyle"
  ],
  "comparisonKey": "peer-equal-four-v0.1-candidate|tuntun_integrated_candidate_v0_1|peer-fixed-model42-unweighted-broad-v0.1-20260907|19-39:1|physical,diabetes,hypertension,lifestyle|birth-month-app-inputs-v0.2|age=35|approx=False",
  "components": [
    {
      "absoluteReferenceScore": 99.73532242540905,
      "available": true,
      "componentKey": "physical",
      "direction": "higher_is_healthier",
      "display": {
        "percentile": 79.2,
        "text": "상위 약 20.8%",
        "topPercentApprox": 20.8
      },
      "displayPolicyVersion": "peer-rank100-v0.2",
      "formulaVersion": "peer-equal-four-v0.1-candidate",
      "includedInComposite": true,
      "label": "신체 참고지표",
      "modelVersion": "tuntun_integrated_candidate_v0_1",
      "peerPercentile": 79.15262397688974,
      "percentileRange": [
        79.15262397688974,
        79.15262397688974
      ],
      "rankDisplay": {
        "rankApprox": 21,
        "rankRange": [
          21,
          21
        ],
        "text": "또래 100명 중 약 21등",
        "tieNotice": null
      },
      "referenceEffectiveN": 2077.0,
      "referenceGroup": "19-39:1",
      "referenceN": 2077,
      "referenceVersion": "peer-fixed-model42-unweighted-broad-v0.1-20260907",
      "source": "model_inference",
      "tieMassPercent": 0.0,
      "topPercentApprox": 20.847376023110257,
      "unavailableReason": null,
      "valueType": "health_direction_peer_percentile"
    },
    {
      "absoluteReferenceScore": 98.90584264767556,
      "available": true,
      "componentKey": "diabetes",
      "direction": "higher_is_healthier",
      "display": {
        "percentile": 65.8,
        "text": "상위 약 34.2%",
        "topPercentApprox": 34.2
      },
      "displayPolicyVersion": "peer-rank100-v0.2",
      "formulaVersion": "peer-equal-four-v0.1-candidate",
      "includedInComposite": true,
      "label": "당뇨 참고지표",
      "modelVersion": "tuntun_integrated_candidate_v0_1",
      "peerPercentile": 65.77620967741936,
      "percentileRange": [
        65.77620967741936,
        65.77620967741936
      ],
      "rankDisplay": {
        "rankApprox": 34,
        "rankRange": [
          34,
          34
        ],
        "text": "또래 100명 중 약 34등",
        "tieNotice": null
      },
      "referenceEffectiveN": 1984.0,
      "referenceGroup": "19-39:1",
      "referenceN": 1984,
      "referenceVersion": "peer-fixed-model42-unweighted-broad-v0.1-20260907",
      "source": "model_inference",
      "tieMassPercent": 0.0,
      "topPercentApprox": 34.22379032258064,
      "unavailableReason": null,
      "valueType": "health_direction_peer_percentile"
    },
    {
      "absoluteReferenceScore": 96.68255635412217,
      "available": true,
      "componentKey": "hypertension",
      "direction": "higher_is_healthier",
      "display": {
        "percentile": 81.0,
        "text": "상위 약 19.0%",
        "topPercentApprox": 19.0
      },
      "displayPolicyVersion": "peer-rank100-v0.2",
      "formulaVersion": "peer-equal-four-v0.1-candidate",
      "includedInComposite": true,
      "label": "고혈압 참고지표",
      "modelVersion": "tuntun_integrated_candidate_v0_1",
      "peerPercentile": 81.04448742746615,
      "percentileRange": [
        81.04448742746615,
        81.04448742746615
      ],
      "rankDisplay": {
        "rankApprox": 19,
        "rankRange": [
          19,
          19
        ],
        "text": "또래 100명 중 약 19등",
        "tieNotice": null
      },
      "referenceEffectiveN": 2068.0,
      "referenceGroup": "19-39:1",
      "referenceN": 2068,
      "referenceVersion": "peer-fixed-model42-unweighted-broad-v0.1-20260907",
      "source": "model_inference",
      "tieMassPercent": 0.0,
      "topPercentApprox": 18.95551257253385,
      "unavailableReason": null,
      "valueType": "health_direction_peer_percentile"
    },
    {
      "absoluteReferenceScore": 90.0,
      "available": true,
      "componentKey": "lifestyle",
      "direction": "higher_is_healthier",
      "display": {
        "percentile": 76.4,
        "text": "상위 약 23.6%",
        "topPercentApprox": 23.6
      },
      "displayPolicyVersion": "peer-rank100-v0.2",
      "formulaVersion": "peer-equal-four-v0.1-candidate",
      "includedInComposite": true,
      "label": "생활습관",
      "modelVersion": "tuntun_integrated_candidate_v0_1",
      "peerPercentile": 76.37019230769232,
      "percentileRange": [
        75.52884615384616,
        77.21153846153847
      ],
      "rankDisplay": {
        "rankApprox": 24,
        "rankRange": [
          23,
          24
        ],
        "text": "또래 100명 중 약 24등",
        "tieNotice": "동점자가 있어 대략적인 위치입니다."
      },
      "referenceEffectiveN": 2080.0,
      "referenceGroup": "19-39:1",
      "referenceN": 2080,
      "referenceVersion": "peer-fixed-model42-unweighted-broad-v0.1-20260907",
      "source": "questionnaire",
      "tieMassPercent": 1.6826923076923066,
      "topPercentApprox": 23.62980769230768,
      "unavailableReason": null,
      "valueType": "health_direction_peer_percentile"
    }
  ],
  "compositeDisplay": {
    "bandLabel": null,
    "score": 75.6,
    "text": "튼튼지수 75.6점",
    "unit": "점"
  },
  "displayPolicyVersion": "peer-rank100-v0.2",
  "formulaVersion": "peer-equal-four-v0.1-candidate",
  "habitContext": {
    "bedToWakeIntervalMinutes": null,
    "bedToWakeStatus": "incomplete_optional_input",
    "lowIntensityMinutes": 60,
    "lowIntensityNotice": "저강도 활동 기록에 반영했습니다. 현재 건강모델·생활습관 점수에는 가산하지 않습니다.",
    "moderateEquivalentMinutes": 120,
    "sleepNotice": "취침부터 기상까지의 시간 간격이며 실제 수면시간·수면의 질·규칙성 점수는 아닙니다.",
    "strengthDaysTopCoded": false,
    "strengthIntensity": "moderate",
    "strengthIntensityNotice": "선택한 근력 강도 설명에 반영합니다. 강도를 높였다고 자동 가산하지 않습니다.",
    "totalReportedActivityMinutes": 180
  },
  "inputMappingVersion": "birth-month-app-inputs-v0.2",
  "inputRevision": "test-64",
  "inputUsage": {
    "aerobicLowMinutes": "context_only_not_scored",
    "aerobicModerateMinutes": "health_models_and_lifestyle",
    "aerobicVigorousMinutes": "health_models_and_lifestyle_times_two",
    "bedtimeWakeTime": "time_interval_context_only_not_scored",
    "birthYearMonth": "model_age_and_peer_reference",
    "heightCm": "health_models",
    "pregnancyStatus": "health_eligibility",
    "sex": "model_and_peer_reference",
    "strengthIntensity": "context_only_not_scored",
    "strengthWeeklyCount": "health_models_and_lifestyle_if_days_confirmed",
    "weightKg": "health_models"
  },
  "isMock": false,
  "isPartialScore": false,
  "isSynthetic": false,
  "lifestyleAvailableSubcomponentCount": 2,
  "modelVersion": "tuntun_integrated_candidate_v0_1",
  "notice": "또래 순위는 건강확률이나 진단이 아닙니다. 부분점수와 서로 다른 비교 기준의 점수는 직접 비교하지 마세요.",
  "peerCompositeScore": 75.5858783473669,
  "referenceCaution": "동일 성별·연령대 개발 표본의 환산 위치입니다. 실제 100명의 등수가 아니며 연령대 변경으로 순위가 달라질 수 있습니다.",
  "referencePopulation": "2019–2021 개발 적격 성인 관측 표본의 동일 성별·연령대 (전국민 대표 아님)",
  "referenceVersion": "peer-fixed-model42-unweighted-broad-v0.1-20260907",
  "referenceYears": [
    2019,
    2020,
    2021
  ],
  "releaseStatus": "LOCAL_REVIEW_CANDIDATE",
  "schemaVersion": "tuntun-app-vnext-v0.2",
  "scoreAvailable": true
}
