{
  "ageContext": {
    "ageTopCoded": false,
    "ageYearsUsed": 35,
    "healthAgeSupported": true,
    "isApproximate": false,
    "notice": "출생연월과 기준일로 만 나이를 계산했습니다.",
    "policy": "completed_birth_month_lower_age_v1",
    "possibleAgeYears": [
      35,
      35
    ],
    "referenceDate": "2026-09-09",
    "timezone": "Asia/Seoul"
  },
  "ageTopCoded": false,
  "availableComponentCount": 0,
  "availableComponents": [],
  "comparisonKey": "peer-equal-four-v0.1-candidate|tuntun_integrated_candidate_v0_1|peer-fixed-model42-unweighted-broad-v0.1-20260907|19-39:1||birth-month-app-inputs-v0.2|age=35|approx=False",
  "components": [
    {
      "absoluteReferenceScore": null,
      "available": false,
      "componentKey": "physical",
      "direction": "higher_is_healthier",
      "display": null,
      "displayPolicyVersion": "peer-rank100-v0.2",
      "formulaVersion": "peer-equal-four-v0.1-candidate",
      "includedInComposite": true,
      "label": "신체 참고지표",
      "modelVersion": "tuntun_integrated_candidate_v0_1",
      "peerPercentile": null,
      "percentileRange": null,
      "rankDisplay": {
        "rankApprox": null,
        "rankRange": null,
        "text": "또래 위치 미산출",
        "tieNotice": null
      },
      "referenceEffectiveN": 2077.0,
      "referenceGroup": "19-39:1",
      "referenceN": 2077,
      "referenceVersion": "peer-fixed-model42-unweighted-broad-v0.1-20260907",
      "source": "unavailable",
      "tieMassPercent": null,
      "topPercentApprox": null,
      "unavailableReason": "MISSING_REQUIRED_INPUT",
      "valueType": "health_direction_peer_percentile"
    },
    {
      "absoluteReferenceScore": null,
      "available": false,
      "componentKey": "diabetes",
      "direction": "higher_is_healthier",
      "display": null,
      "displayPolicyVersion": "peer-rank100-v0.2",
      "formulaVersion": "peer-equal-four-v0.1-candidate",
      "includedInComposite": true,
      "label": "당뇨 참고지표",
      "modelVersion": "tuntun_integrated_candidate_v0_1",
      "peerPercentile": null,
      "percentileRange": null,
      "rankDisplay": {
        "rankApprox": null,
        "rankRange": null,
        "text": "또래 위치 미산출",
        "tieNotice": null
      },
      "referenceEffectiveN": 1984.0,
      "referenceGroup": "19-39:1",
      "referenceN": 1984,
      "referenceVersion": "peer-fixed-model42-unweighted-broad-v0.1-20260907",
      "source": "unavailable",
      "tieMassPercent": null,
      "topPercentApprox": null,
      "unavailableReason": "MISSING_REQUIRED_INPUT",
      "valueType": "health_direction_peer_percentile"
    },
    {
      "absoluteReferenceScore": null,
      "available": false,
      "componentKey": "hypertension",
      "direction": "higher_is_healthier",
      "display": null,
      "displayPolicyVersion": "peer-rank100-v0.2",
      "formulaVersion": "peer-equal-four-v0.1-candidate",
      "includedInComposite": true,
      "label": "고혈압 참고지표",
      "modelVersion": "tuntun_integrated_candidate_v0_1",
      "peerPercentile": null,
      "percentileRange": null,
      "rankDisplay": {
        "rankApprox": null,
        "rankRange": null,
        "text": "또래 위치 미산출",
        "tieNotice": null
      },
      "referenceEffectiveN": 2068.0,
      "referenceGroup": "19-39:1",
      "referenceN": 2068,
      "referenceVersion": "peer-fixed-model42-unweighted-broad-v0.1-20260907",
      "source": "unavailable",
      "tieMassPercent": null,
      "topPercentApprox": null,
      "unavailableReason": "MISSING_REQUIRED_INPUT",
      "valueType": "health_direction_peer_percentile"
    },
    {
      "absoluteReferenceScore": null,
      "available": false,
      "componentKey": "lifestyle",
      "direction": "higher_is_healthier",
      "display": null,
      "displayPolicyVersion": "peer-rank100-v0.2",
      "formulaVersion": "peer-equal-four-v0.1-candidate",
      "includedInComposite": true,
      "label": "생활습관",
      "modelVersion": "tuntun_integrated_candidate_v0_1",
      "peerPercentile": null,
      "percentileRange": null,
      "rankDisplay": {
        "rankApprox": null,
        "rankRange": null,
        "text": "또래 위치 미산출",
        "tieNotice": null
      },
      "referenceEffectiveN": 2080.0,
      "referenceGroup": "19-39:1",
      "referenceN": 2080,
      "referenceVersion": "peer-fixed-model42-unweighted-broad-v0.1-20260907",
      "source": "unavailable",
      "tieMassPercent": null,
      "topPercentApprox": null,
      "unavailableReason": "MISSING_REQUIRED_INPUT",
      "valueType": "health_direction_peer_percentile"
    }
  ],
  "compositeDisplay": {
    "bandLabel": null,
    "score": null,
    "text": "튼튼지수 미산출",
    "unit": "점"
  },
  "displayPolicyVersion": "peer-rank100-v0.2",
  "formulaVersion": "peer-equal-four-v0.1-candidate",
  "habitContext": {
    "bedToWakeIntervalMinutes": null,
    "bedToWakeStatus": "incomplete_optional_input",
    "lowIntensityMinutes": 60,
    "lowIntensityNotice": "저강도 활동 기록에 반영했습니다. 현재 건강모델·생활습관 점수에는 가산하지 않습니다.",
    "moderateEquivalentMinutes": null,
    "sleepNotice": "취침부터 기상까지의 시간 간격이며 실제 수면시간·수면의 질·규칙성 점수는 아닙니다.",
    "strengthDaysTopCoded": false,
    "strengthIntensity": null,
    "strengthIntensityNotice": "선택한 근력 강도 설명에 반영합니다. 강도를 높였다고 자동 가산하지 않습니다.",
    "totalReportedActivityMinutes": null
  },
  "inputMappingVersion": "birth-month-app-inputs-v0.2",
  "inputRevision": "test-64",
  "inputUsage": {
    "aerobicLowMinutes": "context_only_not_scored",
    "aerobicModerateMinutes": "health_models_and_lifestyle",
    "aerobicVigorousMinutes": "health_models_and_lifestyle_times_two",
    "bedtimeWakeTime": "time_interval_context_only_not_scored",
    "birthYearMonth": "model_age_and_peer_reference",
    "heightCm": "health_models",
    "pregnancyStatus": "health_eligibility",
    "sex": "model_and_peer_reference",
    "strengthIntensity": "context_only_not_scored",
    "strengthWeeklyCount": "health_models_and_lifestyle_if_days_confirmed",
    "weightKg": "health_models"
  },
  "isMock": false,
  "isPartialScore": true,
  "isSynthetic": false,
  "lifestyleAvailableSubcomponentCount": 0,
  "modelVersion": "tuntun_integrated_candidate_v0_1",
  "notice": "또래 순위는 건강확률이나 진단이 아닙니다. 부분점수와 서로 다른 비교 기준의 점수는 직접 비교하지 마세요.",
  "peerCompositeScore": null,
  "referenceCaution": "동일 성별·연령대 개발 표본의 환산 위치입니다. 실제 100명의 등수가 아니며 연령대 변경으로 순위가 달라질 수 있습니다.",
  "referencePopulation": "2019–2021 개발 적격 성인 관측 표본의 동일 성별·연령대 (전국민 대표 아님)",
  "referenceVersion": "peer-fixed-model42-unweighted-broad-v0.1-20260907",
  "referenceYears": [
    2019,
    2020,
    2021
  ],
  "releaseStatus": "LOCAL_REVIEW_CANDIDATE",
  "schemaVersion": "tuntun-app-vnext-v0.2",
  "scoreAvailable": false
}
